{
  "tool": "sc-lint-schema-test",
  "version": "0.1.0",
  "schema_version": "0.1.0",
  "status": "fail",
  "scanned_crates": 1,
  "findings": [
    {
      "rule_id": "RULE-001",
      "kind": "contract_fixture",
      "message": "machine contract fixture",
      "owner_ids": ["crate::example::example"],
      "node_ids": ["crate::example::example::item"]
    }
  ]
}
